{
    "details": {
        "date": "2023-11-05",
        "company": "Marine Research Institute",
        "time": "3:00 PM",
        "interviewers": [
            "Sarah White",
            "James Black"
        ]
    },
    "questionsAnswers": [
        {
            "question": "Can you discuss a time when you had to collaborate with a multidisciplinary team?",
            "answer": "I worked on a project that involved marine biologists, environmental engineers, and policy makers to develop a comprehensive marine conservation strategy. My role was to provide scientific insights and ensure that our strategies were based on the latest research.",
            "comments": "Felt confident discussing this as it showcased my ability to work with diverse teams."
        },
        {
            "question": "How do you stay current with the latest research in oceanography?",
            "answer": "I regularly read scientific journals, attend conferences, and participate in webinars. I also collaborate with other researchers and engage in continuous learning through online courses.",
            "comments": "The interviewer seemed impressed with my commitment to staying updated."
        },
        {
            "question": "What are your long-term career goals?",
            "answer": "My long-term goal is to lead a research team focused on marine conservation and to contribute to policy-making processes that protect marine ecosystems.",
            "comments": "I felt passionate and clear about my career aspirations."
        }
    ],
    "selfAssessment": "I think this interview went well. I was able to provide detailed answers and felt more relaxed compared to my previous interviews.",
    "coachAssessment": "John showed improvement in his confidence and communication skills. He provided strong examples and demonstrated his commitment to continuous learning. He should continue to work on providing concise answers."
}
